{
  "template_id": "founding-city-dev-v0.3",
  "generator_version": "0.3",
  "coordinate_system": {
    "units_per_tile": 1000,
    "chunk_size_u": 32000
  },
  "city": {
    "stable_key": "founding-city",
    "name": "Founding City DEV",
    "theme": "compact mountain town"
  },
  "districts": [
    {
      "stable_key": "founders",
      "name": "Founders District",
      "activation_order": 0
    }
  ],
  "activation_bundles": [
    {
      "stable_key": "b0",
      "activation_order": 0,
      "initial_active": true,
      "plot_count": 16
    },
    {
      "stable_key": "b1",
      "activation_order": 1,
      "initial_active": false,
      "plot_count": 20
    },
    {
      "stable_key": "b2",
      "activation_order": 2,
      "initial_active": false,
      "plot_count": 20
    },
    {
      "stable_key": "b3",
      "activation_order": 3,
      "initial_active": false,
      "plot_count": 20
    },
    {
      "stable_key": "b4",
      "activation_order": 4,
      "initial_active": false,
      "plot_count": 20
    },
    {
      "stable_key": "b5",
      "activation_order": 5,
      "initial_active": false,
      "plot_count": 24
    }
  ],
  "road_nodes": [
    {
      "stable_key": "main_w",
      "x_u": -20000,
      "y_u": 0,
      "node_kind": "gate",
      "activation_bundle": null
    },
    {
      "stable_key": "main_c",
      "x_u": 0,
      "y_u": 0,
      "node_kind": "civic",
      "activation_bundle": null
    },
    {
      "stable_key": "main_e",
      "x_u": 20000,
      "y_u": 0,
      "node_kind": "gate",
      "activation_bundle": null
    },
    {
      "stable_key": "b0_n00",
      "x_u": -15000,
      "y_u": 6000,
      "node_kind": "frontage",
      "activation_bundle": "b0"
    },
    {
      "stable_key": "b0_n01",
      "x_u": -15000,
      "y_u": 11000,
      "node_kind": "frontage",
      "activation_bundle": "b0"
    },
    {
      "stable_key": "b0_n02",
      "x_u": -15000,
      "y_u": 16000,
      "node_kind": "frontage",
      "activation_bundle": "b0"
    },
    {
      "stable_key": "b0_n03",
      "x_u": -15000,
      "y_u": 21000,
      "node_kind": "frontage",
      "activation_bundle": "b0"
    },
    {
      "stable_key": "b0_n04",
      "x_u": -15000,
      "y_u": 26000,
      "node_kind": "frontage",
      "activation_bundle": "b0"
    },
    {
      "stable_key": "b0_n05",
      "x_u": -15000,
      "y_u": 31000,
      "node_kind": "frontage",
      "activation_bundle": "b0"
    },
    {
      "stable_key": "b0_n06",
      "x_u": -15000,
      "y_u": 36000,
      "node_kind": "frontage",
      "activation_bundle": "b0"
    },
    {
      "stable_key": "b0_n07",
      "x_u": -15000,
      "y_u": 41000,
      "node_kind": "frontage",
      "activation_bundle": "b0"
    },
    {
      "stable_key": "b0_n08",
      "x_u": -15000,
      "y_u": 46000,
      "node_kind": "frontage",
      "activation_bundle": "b0"
    },
    {
      "stable_key": "b0_n09",
      "x_u": -15000,
      "y_u": 51000,
      "node_kind": "frontage",
      "activation_bundle": "b0"
    },
    {
      "stable_key": "b0_n10",
      "x_u": -15000,
      "y_u": 56000,
      "node_kind": "frontage",
      "activation_bundle": "b0"
    },
    {
      "stable_key": "b0_n11",
      "x_u": -15000,
      "y_u": 61000,
      "node_kind": "frontage",
      "activation_bundle": "b0"
    },
    {
      "stable_key": "b0_n12",
      "x_u": -15000,
      "y_u": 66000,
      "node_kind": "frontage",
      "activation_bundle": "b0"
    },
    {
      "stable_key": "b0_n13",
      "x_u": -15000,
      "y_u": 71000,
      "node_kind": "frontage",
      "activation_bundle": "b0"
    },
    {
      "stable_key": "b0_n14",
      "x_u": -15000,
      "y_u": 76000,
      "node_kind": "frontage",
      "activation_bundle": "b0"
    },
    {
      "stable_key": "b0_n15",
      "x_u": -15000,
      "y_u": 81000,
      "node_kind": "frontage",
      "activation_bundle": "b0"
    },
    {
      "stable_key": "b1_n00",
      "x_u": -9000,
      "y_u": -6000,
      "node_kind": "frontage",
      "activation_bundle": "b1"
    },
    {
      "stable_key": "b1_n01",
      "x_u": -9000,
      "y_u": -11000,
      "node_kind": "frontage",
      "activation_bundle": "b1"
    },
    {
      "stable_key": "b1_n02",
      "x_u": -9000,
      "y_u": -16000,
      "node_kind": "frontage",
      "activation_bundle": "b1"
    },
    {
      "stable_key": "b1_n03",
      "x_u": -9000,
      "y_u": -21000,
      "node_kind": "frontage",
      "activation_bundle": "b1"
    },
    {
      "stable_key": "b1_n04",
      "x_u": -9000,
      "y_u": -26000,
      "node_kind": "frontage",
      "activation_bundle": "b1"
    },
    {
      "stable_key": "b1_n05",
      "x_u": -9000,
      "y_u": -31000,
      "node_kind": "frontage",
      "activation_bundle": "b1"
    },
    {
      "stable_key": "b1_n06",
      "x_u": -9000,
      "y_u": -36000,
      "node_kind": "frontage",
      "activation_bundle": "b1"
    },
    {
      "stable_key": "b1_n07",
      "x_u": -9000,
      "y_u": -41000,
      "node_kind": "frontage",
      "activation_bundle": "b1"
    },
    {
      "stable_key": "b1_n08",
      "x_u": -9000,
      "y_u": -46000,
      "node_kind": "frontage",
      "activation_bundle": "b1"
    },
    {
      "stable_key": "b1_n09",
      "x_u": -9000,
      "y_u": -51000,
      "node_kind": "frontage",
      "activation_bundle": "b1"
    },
    {
      "stable_key": "b1_n10",
      "x_u": -9000,
      "y_u": -56000,
      "node_kind": "frontage",
      "activation_bundle": "b1"
    },
    {
      "stable_key": "b1_n11",
      "x_u": -9000,
      "y_u": -61000,
      "node_kind": "frontage",
      "activation_bundle": "b1"
    },
    {
      "stable_key": "b1_n12",
      "x_u": -9000,
      "y_u": -66000,
      "node_kind": "frontage",
      "activation_bundle": "b1"
    },
    {
      "stable_key": "b1_n13",
      "x_u": -9000,
      "y_u": -71000,
      "node_kind": "frontage",
      "activation_bundle": "b1"
    },
    {
      "stable_key": "b1_n14",
      "x_u": -9000,
      "y_u": -76000,
      "node_kind": "frontage",
      "activation_bundle": "b1"
    },
    {
      "stable_key": "b1_n15",
      "x_u": -9000,
      "y_u": -81000,
      "node_kind": "frontage",
      "activation_bundle": "b1"
    },
    {
      "stable_key": "b1_n16",
      "x_u": -9000,
      "y_u": -86000,
      "node_kind": "frontage",
      "activation_bundle": "b1"
    },
    {
      "stable_key": "b1_n17",
      "x_u": -9000,
      "y_u": -91000,
      "node_kind": "frontage",
      "activation_bundle": "b1"
    },
    {
      "stable_key": "b1_n18",
      "x_u": -9000,
      "y_u": -96000,
      "node_kind": "frontage",
      "activation_bundle": "b1"
    },
    {
      "stable_key": "b1_n19",
      "x_u": -9000,
      "y_u": -101000,
      "node_kind": "frontage",
      "activation_bundle": "b1"
    },
    {
      "stable_key": "b2_n00",
      "x_u": -3000,
      "y_u": 6000,
      "node_kind": "frontage",
      "activation_bundle": "b2"
    },
    {
      "stable_key": "b2_n01",
      "x_u": -3000,
      "y_u": 11000,
      "node_kind": "frontage",
      "activation_bundle": "b2"
    },
    {
      "stable_key": "b2_n02",
      "x_u": -3000,
      "y_u": 16000,
      "node_kind": "frontage",
      "activation_bundle": "b2"
    },
    {
      "stable_key": "b2_n03",
      "x_u": -3000,
      "y_u": 21000,
      "node_kind": "frontage",
      "activation_bundle": "b2"
    },
    {
      "stable_key": "b2_n04",
      "x_u": -3000,
      "y_u": 26000,
      "node_kind": "frontage",
      "activation_bundle": "b2"
    },
    {
      "stable_key": "b2_n05",
      "x_u": -3000,
      "y_u": 31000,
      "node_kind": "frontage",
      "activation_bundle": "b2"
    },
    {
      "stable_key": "b2_n06",
      "x_u": -3000,
      "y_u": 36000,
      "node_kind": "frontage",
      "activation_bundle": "b2"
    },
    {
      "stable_key": "b2_n07",
      "x_u": -3000,
      "y_u": 41000,
      "node_kind": "frontage",
      "activation_bundle": "b2"
    },
    {
      "stable_key": "b2_n08",
      "x_u": -3000,
      "y_u": 46000,
      "node_kind": "frontage",
      "activation_bundle": "b2"
    },
    {
      "stable_key": "b2_n09",
      "x_u": -3000,
      "y_u": 51000,
      "node_kind": "frontage",
      "activation_bundle": "b2"
    },
    {
      "stable_key": "b2_n10",
      "x_u": -3000,
      "y_u": 56000,
      "node_kind": "frontage",
      "activation_bundle": "b2"
    },
    {
      "stable_key": "b2_n11",
      "x_u": -3000,
      "y_u": 61000,
      "node_kind": "frontage",
      "activation_bundle": "b2"
    },
    {
      "stable_key": "b2_n12",
      "x_u": -3000,
      "y_u": 66000,
      "node_kind": "frontage",
      "activation_bundle": "b2"
    },
    {
      "stable_key": "b2_n13",
      "x_u": -3000,
      "y_u": 71000,
      "node_kind": "frontage",
      "activation_bundle": "b2"
    },
    {
      "stable_key": "b2_n14",
      "x_u": -3000,
      "y_u": 76000,
      "node_kind": "frontage",
      "activation_bundle": "b2"
    },
    {
      "stable_key": "b2_n15",
      "x_u": -3000,
      "y_u": 81000,
      "node_kind": "frontage",
      "activation_bundle": "b2"
    },
    {
      "stable_key": "b2_n16",
      "x_u": -3000,
      "y_u": 86000,
      "node_kind": "frontage",
      "activation_bundle": "b2"
    },
    {
      "stable_key": "b2_n17",
      "x_u": -3000,
      "y_u": 91000,
      "node_kind": "frontage",
      "activation_bundle": "b2"
    },
    {
      "stable_key": "b2_n18",
      "x_u": -3000,
      "y_u": 96000,
      "node_kind": "frontage",
      "activation_bundle": "b2"
    },
    {
      "stable_key": "b2_n19",
      "x_u": -3000,
      "y_u": 101000,
      "node_kind": "frontage",
      "activation_bundle": "b2"
    },
    {
      "stable_key": "b3_n00",
      "x_u": 3000,
      "y_u": -6000,
      "node_kind": "frontage",
      "activation_bundle": "b3"
    },
    {
      "stable_key": "b3_n01",